{
  "protocol": "gelium-ux-composition",
  "schema": "gelium://ux-composition/flow/v0.1",
  "version": "0.1",
  "type": "flow",
  "slug": "marketing-home",
  "name": "Public Marketing Home",
  "intent": "Convert visitors into users.",
  "user": "Prospective customer/visitor on a public marketing surface.",
  "primary_task": "Understand the offering and take the primary conversion CTA.",
  "secondary_tasks": [
    "Explore product sections (features, recipes)",
    "Read the docs"
  ],
  "entry_screen": "marketing/home",
  "screens": ["marketing/home"],
  "navigation": [],
  "success_state": "The visitor reaches the primary destination (docs or components) from a real link.",
  "failure_recovery": "404/500 render error-state with retry (R-ERROR-02).",
  "no_js_flow": "Complete: all CTAs are real links; the theme and scheme switchers are 0-JS links; the page renders fully server-side with zero required JS.",
  "htmx_enhancement": "None in v0.1: no HTMX enhancement on the home; no mutation contract to change (R-NOJS-03 n/a).",
  "decision_rules": [
    "R-ACTION-01", "R-SEO-01", "R-GEO-01", "R-NOJS-01",
    "R-ERROR-02"
  ],
  "references": [
    "internal/app/landing.go",
    "docs/gelium/schemas/contracts/public-marketing-page.json"
  ]
}
